{
  "cert_type": "RFS-CERT",
  "cert_version": "v1",
  "resource_budget": {
    "compute_seconds": 30,
    "grid_max": 2048,
    "tolerance": 1e-10
  },
  "isaac_link": {
    "OmegaI_max_resolution": "declared"
  },
  "pcn_sweep": {
    "enabled": true,
    "flips": false
  },
  "pcd_sweep": {
    "enabled": true,
    "flips": false
  },
  "idealizations": [
    {
      "name": "toy_SU2",
      "finite_surrogate": "2x2 complex matrices"
    }
  ],
  "audit_hashes": {
    "code": "AUTO",
    "data": "AUTO",
    "env": "AUTO"
  }
}