{
  "cert_type": "RFS-CERT",
  "cert_version": "v1",
  "resource_budget": {
    "compute_seconds": 30,
    "grid_N_max": 10000
  },
  "isaac_link": {
    "OmegaI_max_resolution": "declared"
  },
  "pcn_sweep": {
    "enabled": true,
    "flips": false
  },
  "pcd_sweep": {
    "enabled": true,
    "flips": false
  },
  "idealizations": [
    {
      "name": "toy_amp_polynomial",
      "finite_surrogate": "finite polynomial amplitude"
    }
  ],
  "audit_hashes": {
    "code": "AUTO",
    "data": "AUTO",
    "env": "AUTO"
  }
}