{
  "cert_type": "RFS-CERT",
  "cert_version": "v1",
  "resource_budget": {
    "compute_seconds": 30
  },
  "isaac_link": {
    "OmegaI_max_resolution": "declared"
  },
  "pcn_sweep": {
    "enabled": true,
    "flips": false
  },
  "pcd_sweep": {
    "enabled": true,
    "flips": false
  },
  "idealizations": [
    {
      "name": "toy_vacuum_fluid",
      "finite_surrogate": "constant-w effective fluid"
    }
  ],
  "audit_hashes": {
    "code": "AUTO",
    "data": "AUTO",
    "env": "AUTO"
  }
}