{
  "cert_type": "RFS-CERT",
  "cert_version": "v1",
  "resource_budget": {
    "compute_seconds": 30,
    "grid_max": 4096
  },
  "isaac_link": {
    "OmegaI_max_resolution": "declared"
  },
  "pcn_sweep": {
    "enabled": true,
    "flips": false
  },
  "pcd_sweep": {
    "enabled": true,
    "flips": false
  },
  "idealizations": [
    {
      "name": "toy_RG",
      "finite_surrogate": "log running of one coefficient"
    }
  ],
  "audit_hashes": {
    "code": "AUTO",
    "data": "AUTO",
    "env": "AUTO"
  }
}